{
  "schema_version": "5.1",
  "kind": "production",
  "lineage": {
    "storyboard": "aef15987aeb1f114e90d4cb71406b3f9dfafe6b63f0a3478309d5b6248b35a75",
    "assets": "a27d0da422a8d8c96c4cb5fb16326607908be9f25ca54cb5df4ef21898eaf24c"
  },
  "units": [
    {
      "unit_id": "SEG001",
      "segment_id": "SEG001",
      "scene_id": "SCN_LIVING_NIGHT",
      "duration_s": 5.0,
      "include_in_final": true,
      "spatial_anchor": "LOCK_SC01_A01",
      "state_ids": {
        "incoming": "SEG001_INCOMING",
        "current": "SEG001_CURRENT",
        "end": "SEG001_END"
      },
      "continuation_source": {
        "unit_id": "LOCK_SC01_A01",
        "tail_frames": 22,
        "fps": 24,
        "guide_frame_idx": 0,
        "inherit_audio": false
      },
      "shot_ids": [
        "SH001",
        "SH002"
      ],
      "events": [],
      "active_speakers": [
        "CHAR_A",
        "CHAR_B"
      ],
      "primary_listener": null,
      "secondary_listeners": [],
      "h3_mode": "REF2VA"
    }
  ],
  "production_profile": "DRAMA_DIALOGUE",
  "final_runtime_s": 5,
  "final_segment_count": 1
}