{
  "schema_version": "5.1",
  "kind": "production",
  "lineage": {
    "storyboard": "40f148f84f9d637b622dc25e9a83fcaf98f9fdb32a90d0d0a5694ee5c7b9c8aa",
    "assets": "c2535f73c001aa97dc7066f711a7bcadf7be5660dd4d337c12296c96e9d655c1"
  },
  "units": [
    {
      "unit_id": "SEG001",
      "segment_id": "SEG001",
      "scene_id": "SCN_LIVING_NIGHT",
      "duration_s": 5.0,
      "include_in_final": true,
      "spatial_anchor": "LOCK_SC01_A01",
      "state_ids": {
        "incoming": "SEG001_INCOMING",
        "current": "SEG001_CURRENT",
        "end": "SEG001_END"
      },
      "continuation_source": {
        "unit_id": "LOCK_SC01_A01",
        "tail_frames": 22,
        "fps": 24,
        "guide_frame_idx": 0,
        "inherit_audio": false
      },
      "shot_ids": [
        "SH001",
        "SH002"
      ],
      "events": [
        {
          "at_s": 4.8,
          "event": {
            "op": "prop",
            "at_s": 4.8,
            "prop_id": "SHIRT",
            "from_holder": "CHAR_A.right_hand",
            "holder": "CHAIR",
            "state": {
              "cn": "搭在椅背",
              "en": "draped over the chair back"
            },
            "description": {
              "cn": "用右手把衬衫放在椅背",
              "en": "Place the shirt on the chair back with the right hand"
            }
          },
          "before_state_id": "SEG001_T1_BEFORE",
          "after_state_id": "SEG001_T1_AFTER"
        }
      ],
      "active_speakers": [
        "CHAR_A",
        "CHAR_B"
      ],
      "primary_listener": null,
      "secondary_listeners": [],
      "h3_mode": "REF2VA"
    },
    {
      "unit_id": "SEG002",
      "segment_id": "SEG002",
      "scene_id": "SCN_LIVING_NIGHT",
      "duration_s": 5.0,
      "include_in_final": true,
      "spatial_anchor": "LOCK_SC01_A01",
      "state_ids": {
        "incoming": "SEG002_INCOMING",
        "current": "SEG002_CURRENT",
        "end": "SEG002_END"
      },
      "continuation_source": {
        "unit_id": "SEG001",
        "tail_frames": 22,
        "fps": 24,
        "guide_frame_idx": 0,
        "inherit_audio": false
      },
      "shot_ids": [
        "SH003",
        "SH004"
      ],
      "events": [],
      "active_speakers": [
        "CHAR_A",
        "CHAR_B"
      ],
      "primary_listener": null,
      "secondary_listeners": [],
      "h3_mode": "REF2VA"
    },
    {
      "unit_id": "SEG003",
      "segment_id": "SEG003",
      "scene_id": "SCN_LIVING_NIGHT",
      "duration_s": 5.0,
      "include_in_final": true,
      "spatial_anchor": "LOCK_SC01_A01",
      "state_ids": {
        "incoming": "SEG003_INCOMING",
        "current": "SEG003_CURRENT",
        "end": "SEG003_END"
      },
      "continuation_source": {
        "unit_id": "SEG002",
        "tail_frames": 22,
        "fps": 24,
        "guide_frame_idx": 0,
        "inherit_audio": false
      },
      "shot_ids": [
        "SH005",
        "SH006"
      ],
      "events": [],
      "active_speakers": [
        "CHAR_A",
        "CHAR_B"
      ],
      "primary_listener": null,
      "secondary_listeners": [],
      "h3_mode": "REF2VA"
    }
  ],
  "production_profile": "DRAMA_DIALOGUE",
  "final_runtime_s": 15,
  "final_segment_count": 3
}
